{
  "id": "feature.community-health-files.org-defaults",
  "type": "feature",
  "name": "Default community health files from the .github repository",
  "source": "https://docs.github.com/en/communities/setting-up-your-project-for-healthy-contributions/creating-a-default-community-health-file",
  "measuredAt": "2026-10-31",
  "attrs": {
    "verdict": "allowed",
    "fetched_at": "2026-10-31T11:49:57Z",
    "quote": "GitHub will use and display default files for any repository owned by the account, regardless of the destination repository's visibility, that does not have its own file of that type."
  },
  "edges": [
    {
      "rel": "appliesTo",
      "to": "product.community-health-files"
    },
    {
      "rel": "requires",
      "to": "rule.community-health-files.github-repo-public"
    }
  ]
}
