{
  "id": "example.limit.concurrent-jobs",
  "type": "limit",
  "name": "Concurrent jobs on an example plan",
  "source": "https://example.com/docs/limits",
  "measuredAt": "2026-02-28",
  "attrs": {
    "verdict": "limited",
    "fetched_at": "2026-10-31T12:00:00Z",
    "quote": "Example plan | 20 | 5",
    "value": 20,
    "unit": "jobs",
    "scope": "example plan, total concurrent jobs"
  },
  "edges": []
}
