{
  "id": "rule.actions.cache-eviction",
  "type": "rule",
  "name": "Cache entries evicted after 7 days without access",
  "source": "https://docs.github.com/en/actions/reference/workflows-and-actions/dependency-caching",
  "measuredAt": "2026-10-31",
  "attrs": {
    "verdict": "limited",
    "fetched_at": "2026-10-31T11:49:26Z",
    "quote": "GitHub will remove any cache entries that have not been accessed in over 7 days.",
    "value": 7,
    "unit": "days",
    "scope": "cache entries not accessed"
  },
  "edges": [
    {
      "rel": "limits",
      "to": "product.actions"
    }
  ]
}
