{
  "id": "feature.security.security-policy",
  "type": "feature",
  "name": "Security policy (SECURITY.md)",
  "source": "https://docs.github.com/en/code-security/how-tos/report-and-fix-vulnerabilities/configure-vulnerability-reporting/add-security-policy",
  "measuredAt": "2026-10-31",
  "attrs": {
    "verdict": "allowed",
    "fetched_at": "2026-10-31T11:49:57Z",
    "quote": "You can give instructions for how to report a security vulnerability in your project by adding a security policy to your repository."
  },
  "edges": [
    {
      "rel": "appliesTo",
      "to": "product.community-health-files"
    },
    {
      "rel": "appliesTo",
      "to": "product.private-vulnerability-reporting"
    }
  ]
}
