{
  "id": "rule.actions.fork-pr-approval-options",
  "type": "rule",
  "name": "Approval for running fork pull request workflows from contributors setting",
  "source": "https://docs.github.com/en/repositories/managing-your-repositorys-settings-and-features/enabling-features-for-your-repository/managing-github-actions-settings-for-a-repository",
  "measuredAt": "2026-10-31",
  "attrs": {
    "verdict": "limited",
    "fetched_at": "2026-10-31T11:49:57Z",
    "quote": "If approval is required, a user with write access to the repository must approve the pull request workflow to be run.",
    "scope": "workflows from fork pull requests"
  },
  "edges": [
    {
      "rel": "appliesTo",
      "to": "product.actions"
    },
    {
      "rel": "supersedes",
      "to": "rule.actions.fork-pr-approval-default"
    }
  ]
}
