{
  "id": "product.community-health-files",
  "type": "product",
  "name": "Default community health files",
  "source": "https://docs.github.com/en/communities/setting-up-your-project-for-healthy-contributions/creating-a-default-community-health-file",
  "measuredAt": "2026-10-31",
  "attrs": {
    "verdict": "allowed",
    "fetched_at": "2026-10-31T12:20:00Z",
    "quote": "Default files will be used for any repository owned by the account that does not contain its own file of that type."
  },
  "edges": []
}
