{
  "id": "plan.actions.free-included-compute",
  "type": "plan",
  "name": "Free plan included compute for private repositories",
  "source": "https://docs.github.com/en/billing/concepts/product-billing/github-actions",
  "measuredAt": "2026-10-31",
  "attrs": {
    "verdict": "limited",
    "fetched_at": "2026-10-31T11:49:26Z",
    "quote": "| GitHub Free | 500 MB | $12 USD | 10 GB | Not applicable |",
    "value": 12,
    "unit": "USD",
    "scope": "private repositories, GitHub Free",
    "window": "per month"
  },
  "edges": [
    {
      "rel": "appliesTo",
      "to": "plan.free"
    },
    {
      "rel": "limits",
      "to": "product.actions"
    }
  ]
}
