{
  "id": "rule.api.secondary-retry-after",
  "type": "rule",
  "name": "Exceeding a secondary limit: honour retry-after",
  "source": "https://docs.github.com/en/rest/using-the-rest-api/rate-limits-for-the-rest-api",
  "measuredAt": "2026-10-31",
  "attrs": {
    "verdict": "denied",
    "fetched_at": "2026-10-31T11:49:35Z",
    "quote": "If the retry-after response header is present, you should not retry your request until after that many seconds has elapsed."
  },
  "edges": [
    {
      "rel": "appliesTo",
      "to": "product.rest-api"
    }
  ]
}
