{
  "id": "feature.security.report-a-vulnerability-button",
  "type": "feature",
  "name": "\"Report a vulnerability\" button for reporters",
  "source": "https://docs.github.com/en/code-security/how-tos/report-and-fix-vulnerabilities/configure-vulnerability-reporting/configure-for-a-repository",
  "measuredAt": "2026-10-31",
  "attrs": {
    "verdict": "allowed",
    "fetched_at": "2026-10-31T11:49:57Z",
    "quote": "When private vulnerability reporting is enabled, security researchers see a Report a vulnerability button on the repository\u2019s \"Advisories\" page, which allows them to submit a private report."
  },
  "edges": [
    {
      "rel": "requires",
      "to": "feature.security.private-vulnerability-reporting"
    }
  ]
}
