{
  "id": "permission.github-token.auto-merge",
  "type": "permission",
  "name": "pull-requests: write for gh pr merge --auto",
  "source": "https://docs.github.com/en/pull-requests/collaborating-with-pull-requests/incorporating-changes-from-a-pull-request/automatically-merging-a-pull-request",
  "measuredAt": "2026-10-31",
  "attrs": {
    "verdict": "unknown",
    "fetched_at": "2026-10-31T11:55:00Z",
    "quote": "People with write permissions to a repository can enable auto-merge for a pull request."
  },
  "edges": [
    {
      "rel": "appliesTo",
      "to": "product.github-token"
    },
    {
      "rel": "appliesTo",
      "to": "product.auto-merge"
    }
  ]
}
