{
  "id": "rate-limit.secondary.rest-points",
  "type": "rate-limit",
  "name": "Secondary limit, REST points per minute",
  "source": "https://docs.github.com/en/rest/using-the-rest-api/rate-limits-for-the-rest-api",
  "measuredAt": "2026-10-31",
  "attrs": {
    "verdict": "limited",
    "fetched_at": "2026-10-31T11:49:35Z",
    "quote": "No more than 900 points per minute are allowed for REST API endpoints, and no more than 2,000 points per minute are allowed for the GraphQL API endpoint.",
    "value": 900,
    "unit": "points",
    "scope": "per endpoint",
    "window": "per minute"
  },
  "edges": [
    {
      "rel": "appliesTo",
      "to": "product.rest-api"
    }
  ]
}
