{
  "id": "rule.rulesets.availability-free-public",
  "type": "rule",
  "name": "Rulesets available for public repositories on GitHub Free",
  "source": "https://docs.github.com/en/repositories/configuring-branches-and-merges-in-your-repository/managing-rulesets/about-rulesets",
  "measuredAt": "2026-10-31",
  "attrs": {
    "verdict": "limited",
    "fetched_at": "2026-10-31T11:51:00Z",
    "quote": "Rulesets are available in public repositories with GitHub Free and GitHub Free for organizations, and in public and private repositories with GitHub Pro, GitHub Team, and GitHub Enterprise Cloud.",
    "scope": "public repositories (Free); public and private (Pro, Team, Enterprise Cloud)"
  },
  "edges": [
    {
      "rel": "appliesTo",
      "to": "product.rulesets"
    },
    {
      "rel": "availableOn",
      "to": "plan.free"
    }
  ]
}
