{
  "id": "limit.canary.observed-concurrency",
  "type": "limit",
  "name": "Concurrent jobs observed on the canary",
  "source": "https://github.com/practice-library/.github/actions/runs/41195771306",
  "measuredAt": "2026-10-31",
  "attrs": {
    "verdict": "limited",
    "fetched_at": "2026-10-31T12:15:00Z",
    "quote": "Matrix: probe 20 jobs completed",
    "value": 5,
    "unit": "concurrent jobs",
    "scope": "observed on two canary runs, from the job start and end times in the run's jobs list; below the documented Free-plan limit"
  },
  "edges": [
    {
      "rel": "appliesTo",
      "to": "limit.actions.concurrent-jobs-free"
    }
  ]
}
